{
  "manifest_version": "1.0",
  "connector_id": "steam-playwright",
  "source_id": "steam",
  "version": "1.0.0",
  "name": "Steam",
  "company": "valve",
  "description": "Exports your Steam profile, game library with playtime stats, and friend list using the Steam Web API.",
  "runtime": "playwright",
  "page_api_version": 1,
  "connect_url": "https://steamcommunity.com/dev/apikey",
  "connect_selector": "input#domain",
  "icon": "icons/steam.svg",
  "scopes": [
    {
      "scope": "steam.profile",
      "label": "Your Profile",
      "description": "Steam profile including persona name, avatar, level, country, and account age"
    },
    {
      "scope": "steam.games",
      "label": "Your Games",
      "description": "Owned games with playtime statistics, plus recently played games"
    },
    {
      "scope": "steam.friends",
      "label": "Your Friends",
      "description": "Friend list with persona names, avatars, and friendship dates"
    }
  ],
  "id": "steam-playwright",
  "connectURL": "https://steamcommunity.com/dev/apikey",
  "connectSelector": "input#domain",
  "iconURL": "icons/steam.svg",
  "exportFrequency": "weekly",
  "vectorize_config": {
    "documents": "steam.games.owned[].name"
  }
}
