{
  "manifest_version": "1.0",
  "connector_id": "claude-playwright",
  "source_id": "claude",
  "version": "2.0.0",
  "name": "Claude (Live API)",
  "company": "Anthropic",
  "description": "Exports your Claude conversations and projects from claude.ai.",
  "runtime": "playwright",
  "page_api_version": 1,
  "connect_url": "https://claude.ai/login",
  "connect_selector": "button[data-testid='user-menu-button']",
  "icon": "icons/claude.svg",
  "scopes": [
    {
      "scope": "claude.conversations",
      "label": "Your Claude conversations",
      "description": "Claude conversations including chat metadata and, when available, full thread messages from Claude's authenticated APIs."
    },
    {
      "scope": "claude.projects",
      "label": "Your Claude projects",
      "description": "Claude projects including project metadata and, when available, project detail from Claude's authenticated APIs."
    }
  ],
  "id": "claude-playwright",
  "connectURL": "https://claude.ai/login",
  "connectSelector": "button[data-testid='user-menu-button']",
  "iconURL": "icons/claude.svg",
  "exportFrequency": "weekly",
  "vectorize_config": {
    "documents": "title"
  }
}
